{"submission_id":"SUB-REQ-1","project_id":"PRJ-1","stage":"REQUIREMENT","artifact_refs":[{"artifact_type":"SRS","artifact_ref":"docs/requirements/software-requirements-specification.md","content_hash":"sha256:aaaaaaaaaaaaaaaaaaaaaaaaaaaaaaaaaaaaaaaaaaaaaaaaaaaaaaaaaaaaaaaa"}],"source_session_id":"SES-PROJECT-1","source_message_id":"oc-message-42","agent_role":"REQUIREMENT","agent_definition_ref":{"id":"AGT-REQUIREMENT","version":"1.0.0","content_hash":"sha256:bbbbbbbbbbbbbbbbbbbbbbbbbbbbbbbbbbbbbbbbbbbbbbbbbbbbbbbbbbbbbbbb"},"skill_refs":[{"id":"factory-requirement-grilling","version":"1.0.0","content_hash":"sha256:cccccccccccccccccccccccccccccccccccccccccccccccccccccccccccccccc"}],"model_ref":"openai/gpt-5.6-luna#max","status":"READY_FOR_REVIEW","submitted_at":"2026-08-06T10:00:00Z"}
